,name,rating,address,avg_price,url,place_id,coordinates,lat,lng,review,tel
5,Fleur Lis 芙洛麗大飯店,4.0,新竹市東區民族路69號,500,https://ifoodie.tw/restaurant/55960bbec03a10072a153879-Fleur-Lis-%E8%8A%99%E6%B4%9B%E9%BA%97%E5%A4%A7%E9%A3%AF%E5%BA%97,ChIJ2wj3W8M1aDQRK0HnRKo0ptI,"{'lat': 24.807079, 'lng': 120.975231}",24.807079,120.975231,"[{'author_name': 'Jerry peng', 'author_url': 'https://www.google.com/maps/contrib/113145765304977019675/reviews', 'language': 'zh-Hant', 'profile_photo_url': 'https://lh5.googleusercontent.com/-UKxi_3hMXK4/AAAAAAAAAAI/AAAAAAAAAAA/AMZuucnCptKnEmep-n7vn5Gxl5Nry7Kyng/s128-c0x00000000-cc-rp-mo-ba5/photo.jpg', 'rating': 3, 'relative_time_description': '本週', 'text': '芙洛麗_食譜自助百匯：\n\n評價：🌟🌟🌟.5\n\n在放假前夕⋯感謝三位同事請公司同人吃飯！（恭喜恭喜🎉）剛巧來吃⋯我還沒來吃過的飯店，之前常常聽到⋯蠻兩極的評價的！今天來嚐鮮就知道⋯到底如何了？！😂\n\n#食感：食材的樣式比想像中的多！但⋯大多蠻普通的！比較覺得好吃的就是⋯現煎鐵板這攤！丹麥梅花豬肉香濃郁，肉質多汁，香煎藍鑽白蝦淡淡米酒去腥提鮮，肉質Q彈，胡椒點綴香氣！再來就是鮭魚壽司油酯鮮香入口滑嫩有點點可惜的是醋飯稍稍有一點點偏乾，冰淇淋莫凡彼，Haagen-Dazs ，完美的Ending ！給大家參考一下！😆\n\n#小提醒：當月壽星打8折喔！😊', 'time': 1607752824}, {'author_name': '諾爾蔓', 'author_url': 'https://www.google.com/maps/contrib/106299072235590574625/reviews', 'language': 'zh-Hant', 'profile_photo_url': 'https://lh5.googleusercontent.com/-vjY-HmTD1OY/AAAAAAAAAAI/AAAAAAAAAAA/AMZuucmFzqgMPg9xvzNgyuJvzSgY4CEOcQ/s128-c0x00000000-cc-rp-mo-ba5/photo.jpg', 'rating': 4, 'relative_time_description': '3 個月前', 'text': '新竹優質服務美食餐廳🍴，新竹芙洛麗大飯店', 'time': 1599529497}, {'author_name': 'I ris', 'author_url': 'https://www.google.com/maps/contrib/112268228157024473714/reviews', 'language': 'zh-Hant', 'profile_photo_url': 'https://lh3.googleusercontent.com/a-/AOh14GgEJZ_0sNbLYMHkRtnX8gJEj8VAKjI3_LasdnLOfA=s128-c0x00000000-cc-rp-mo', 'rating': 2, 'relative_time_description': '1 個月前', 'text': '一樓的食譜自助百匯，種類頗多，甜點有一定水準，馬卡龍很美味！但燒烤類的廚師們，態度非常不耐煩，看到用餐的人排隊等著拿，不僅口氣很兇，而且完全不理詢問，右邊串燒及烤箱區三個廚師顧著一直聊天。鐵板的師父則是，在煎牛排時，幾度不悅把蝦子用力挖起來看幾眼，再甩下煎台上，最後是把煎熟的蝦子用甩的，扔進煎台旁的鐵盒，客人其實都站在台前看著廚師，雖然鐵板的藍鑽蝦很新鮮大尾，但廚師用什麼心情對待食物，食物就呈現什麼程度的口味。\n整體而言，除了外場服務人員，整理桌面火速，且每位都很親切，接近滿分的服務品質，其他內場熟食區的廚師，完全不及格，看到師父很不樂意煎的樣子，再好的食材也沒吸引力去，大幅降低再訪的意願。', 'time': 1604410078}, {'author_name': '郭俊廷', 'author_url': 'https://www.google.com/maps/contrib/106376262084718107745/reviews', 'language': 'zh-Hant', 'profile_photo_url': 'https://lh4.googleusercontent.com/-Q3MbAACTJBU/AAAAAAAAAAI/AAAAAAAAAAA/AMZuucn30jUeWo9brqtboKyIbyxhbt5f9Q/s128-c0x00000000-cc-rp-mo/photo.jpg', 'rating': 3, 'relative_time_description': '2 個月前', 'text': '先說好的部分：\n1. 床很舒服，躺下能秒睡\n2. 自助早餐也很豐盛，竟然有哈根達斯\n3. 停車方便，開車到城隍廟只要10-15分鐘。\n\n至於缺點，真的覺得如果想好好經營飯店這部分，希望能改善\n1. 帶小寶寶來的旅客可能要三思，備註嬰兒床、消毒鍋、澡盆都沒問題準備好好，但重點是嬰兒床竟然只有遊戲床，而且是低到底的床還不能調整高度，這種嬰兒床還真是第一次在飯店看到，非常難哄小孩而且也不好睡，多一點投資更新成好一點的嬰兒床應該不難吧⋯⋯\n2. 浴室盥洗備品沒有潤髮乳，對女生旅客來說很不方便，這些真的沒值多少錢，可以投資一下吧\n3. 價格偏貴，住房價跟新竹國賓老爺差不太多了，但又沒什麼設施可玩', 'time': 1600689625}, {'author_name': 'Ivey Fang', 'author_url': 'https://www.google.com/maps/contrib/110244868426012805778/reviews', 'language': 'zh-Hant', 'profile_photo_url': 'https://lh6.googleusercontent.com/-rEaP-7r6UsE/AAAAAAAAAAI/AAAAAAAAAAA/AMZuucnSqtq9rDZozbbgGJkQVqdiGCb6bA/s128-c0x00000000-cc-rp-mo/photo.jpg', 'rating': 1, 'relative_time_description': '4 個月前', 'text': '一樓自助餐的餐點份量永遠都不夠，少少的菜卻接一堆的客人，造成所有的客人都在排隊等食，不誇張，每個客人就像是乞丐一樣的在討食，連餐盤都沒有可以用，超可憐的。好不容易排了15分鐘以上，結果只能拿二貫小小的握壽司，也就是說二個小時的用餐時間，客人至少要花一個小時在排隊。還有那""舒芙蕾""，20分鐘只可以出爐8份，這真的是笑死人了！一個餐廳一次接待200位以上的客人，但二個小時只願意出爐50份左右的甜品，實在是差勁極了！！\n\n座位方面也很爛！我們訂9位，但卻給我們6人座來擠，芙洛麗要賺錢也不是這樣的賺法吧！硬塞一堆客人，上菜速度慢，餐食不夠吃，連座位都要客人硬擠，這樣的用餐品質真的很差，也難怪芙洛麗給人的評價就像夜市一樣等級，是上不了台面的。\n\n如果可以，我連一顆星星都不願意給', 'time': 1597576790}]",36238899
6,EISEN bistro,4.6,新竹市東區民權路208號,877,https://ifoodie.tw/restaurant/55a5f84bc03a102ec1415b7b-EISEN-bistro,ChIJCcRRB8U1aDQR-m7NrAqo8JA,"{'lat': 24.8104925, 'lng': 120.9732995}",24.8104925,120.9732995,"[{'author_name': 'Jerry Chang', 'author_url': 'https://www.google.com/maps/contrib/113010939090036847153/reviews', 'language': 'zh-Hant', 'profile_photo_url': 'https://lh3.googleusercontent.com/a-/AOh14GhHRQmqmNnFg1vV2HD5V1hy865D2isXH_k_aZlr=s128-c0x00000000-cc-rp-mo-ba4', 'rating': 4, 'relative_time_description': '2 個月前', 'text': '東西好吃 酒下次喝看看', 'time': 1600619568}, {'author_name': '蔡明嘉', 'author_url': 'https://www.google.com/maps/contrib/112995856628692086736/reviews', 'language': 'zh-Hant', 'profile_photo_url': 'https://lh3.googleusercontent.com/a-/AOh14Gh42HJos-uCHLf4UHq_wqqL9zbjj92AfVMSea5CuQ=s128-c0x00000000-cc-rp-mo-ba5', 'rating': 3, 'relative_time_description': '1 個月前', 'text': '環境舒適，位置多且不會擠\n附近可以停東大路停車場或巨城\n採光好，服務親切\n廁所在二樓有兩間，蠻乾淨的且貼心，其中一間有尿布台\n食物選擇多還有多種啤酒（草莓啤酒很好喝）\n但味道普通跟價格比起來有點貴\n必吃大概就是炸海鮮，雖然黑嚕嚕但炸得酥脆肉質嫩\n奶油燉雞份量是不錯但肉質稍柴\n剝皮辣椒雞義大利麵感覺就是普通會辣的義大利麵配上雞肉，味道沒有融合\n用筷子吃感覺其實沒有很方便', 'time': 1603786480}, {'author_name': 'Pohau Huang', 'author_url': 'https://www.google.com/maps/contrib/113682138699661642655/reviews', 'language': 'zh-Hant', 'profile_photo_url': 'https://lh3.googleusercontent.com/a-/AOh14GhM6IKW0r9IwQxXDAhpdcyNlQIaI5Y5GUdkakl3yA=s128-c0x00000000-cc-rp-mo', 'rating': 5, 'relative_time_description': '3 週前', 'text': '每道菜都比謝還驚艷，好吃到舔盤子！龍蝦米糕真的有隻龍蝦，炸物拼盤紹興雞啤酒蚵高粱香腸的酒香味讓我想泡在酒桶裡，大力推薦豬腳，吃完後立刻再打包一份回家，也佩服餐廳的選酒品味啤酒葡萄酒各有特色，來新竹一定要留一餐來艾昇，記得訂位！', 'time': 1605944742}, {'author_name': 'Yi-Jung Hsu', 'author_url': 'https://www.google.com/maps/contrib/106256503867678019914/reviews', 'language': 'zh-Hant', 'profile_photo_url': 'https://lh5.googleusercontent.com/-Fg_2HGQsrRw/AAAAAAAAAAI/AAAAAAAAAAA/AMZuucnrLT_gROwduqo4zUI3Z1r20JbggQ/s128-c0x00000000-cc-rp-mo-ba3/photo.jpg', 'rating': 4, 'relative_time_description': '2 週前', 'text': '融合台式與西餐的料理，今天的每日例湯是蘑菇濃湯，菇味濃厚，開胃菜的蚵仔酥還有一些炸蔬菜滿好吃的，青醬義大利麵普通，推薦海鮮燉飯，海鮮給的滿多的，蝦子有先烤過的香氣，下次會想再跟親朋好友來嚐嚐別的菜色。', 'time': 1606553874}, {'author_name': 'Carolina Zeng', 'author_url': 'https://www.google.com/maps/contrib/102285534764443610802/reviews', 'language': 'zh-Hant', 'profile_photo_url': 'https://lh3.googleusercontent.com/a-/AOh14Ghg_GUNRD8J14KEe1cL13A_rWrxbvW7fYrwJDizuA=s128-c0x00000000-cc-rp-mo-ba5', 'rating': 5, 'relative_time_description': '1 個月前', 'text': '新竹CP很高的餐酒館\n店內的裝潢滿文青的\n二樓白天人太少的話不會開放\n但可以跟店家說一下能上去拍照\n陽光打下來的時候拍餐點真的很美\n最推薦他們的鳳梨梅子冰沙\n酸甜酸甜的\n會為了那杯冰沙再訪的\n其他的餐點也都表現的不錯\n有道蝦子烘蛋的也是推薦必點\n不油膩好吃\n布丁的部分相較之下遜色的點\n但絕對是值得點一顆來拍照讓相機過過癮', 'time': 1603793618}]",35350008
7,冪La Miette Cafe,4.5,新竹市北區經國路二段352號,500,https://ifoodie.tw/restaurant/58ff8fc32756dd5ad165d92e-%E5%86%AALa-Miette-Cafe,ChIJd7eAy701aDQRpcLoedSl-s0,"{'lat': 24.807983, 'lng': 120.957869}",24.807983,120.957869,"[{'author_name': '鄭世宏', 'author_url': 'https://www.google.com/maps/contrib/101163178852466048913/reviews', 'language': 'zh-Hant', 'profile_photo_url': 'https://lh4.googleusercontent.com/-FwztgruZ6HU/AAAAAAAAAAI/AAAAAAAAAAA/AMZuucnSh_FMK7sZCUGgKvIS_fxgrA7kng/s128-c0x00000000-cc-rp-mo/photo.jpg', 'rating': 2, 'relative_time_description': '3 個月前', 'text': '餐點OK\n桌子小,服務不及格', 'time': 1600060869}, {'author_name': '張晴晴', 'author_url': 'https://www.google.com/maps/contrib/115488684996622393095/reviews', 'language': 'zh-Hant', 'profile_photo_url': 'https://lh6.googleusercontent.com/-Mjk0R7-oXgM/AAAAAAAAAAI/AAAAAAAAAAA/AMZuucmDFmad67emjFgGst2I69MgsRqm5g/s128-c0x00000000-cc-rp-mo-ba3/photo.jpg', 'rating': 4, 'relative_time_description': '3 個月前', 'text': '烤飯不錯，奶酪非常推薦', 'time': 1600190369}, {'author_name': 'ching chu', 'author_url': 'https://www.google.com/maps/contrib/107944122872555646772/reviews', 'language': 'zh-Hant', 'profile_photo_url': 'https://lh3.googleusercontent.com/-34hGYpANAXo/AAAAAAAAAAI/AAAAAAAAAAA/AMZuuclNaJG6kGMK0LwAbOegN65_WDsBpg/s128-c0x00000000-cc-rp-mo-ba3/photo.jpg', 'rating': 5, 'relative_time_description': '4 個月前', 'text': '多訪後來評論區朝聖看看某個自以為事的新竹美食評論家拿幾個月前的照片來評論留言，看完之後覺得某個評論家還是回去喝魚丸湯，吃臭豆腐比較符合自身習慣加工食物的味覺 據說店家並沒有胡麻沙拉阿？人家西餐你說他出三小胡麻沙拉，整天要CP值那您怎麼不去準備個碗坐在便利商店門口，這樣有冷氣有人潮又有錢領還不用什麼成本就能賺錢，CP值特高呢~', 'time': 1597820559}, {'author_name': 'AbY', 'author_url': 'https://www.google.com/maps/contrib/104967649105519559242/reviews', 'language': 'zh-Hant', 'profile_photo_url': 'https://lh5.googleusercontent.com/-VRHp8RrP3Uk/AAAAAAAAAAI/AAAAAAAAAAA/AMZuuclVE5zJIFSaevUgNhpVc82Psh0Icw/s128-c0x00000000-cc-rp-mo-ba3/photo.jpg', 'rating': 4, 'relative_time_description': '本週', 'text': '店內裝潢很網美，空間感覺舒適，桌距也足夠不會受別桌影響，洗手間讓女生感覺很貼心。我跟朋友只單點義大利麵&甜點... 麵口味OK，但或許那些名稱看起來有趣的菜會更好吃? 甜點非常推蜂蜜脆片戚風! 但檸檬糖霜蛋糕卻有點失望，可能我剛好比較喜歡冷/凝固的檸檬糖霜吧...(會烤熱了上桌，糖霜變成融在盤面的檸檬糖液，蛋糕口感也變的偏軟)', 'time': 1608049850}, {'author_name': 'Ilona Lao', 'author_url': 'https://www.google.com/maps/contrib/102673467575014790918/reviews', 'language': 'zh-Hant', 'profile_photo_url': 'https://lh5.googleusercontent.com/-IkTvc71r0XA/AAAAAAAAAAI/AAAAAAAAAAA/AMZuuclaBspX-ULmrdz818GbbP4O3zSrQQ/s128-c0x00000000-cc-rp-mo/photo.jpg', 'rating': 1, 'relative_time_description': '1 個月前', 'text': '上菜速度真的慢到一個可以，叫外場人員介紹個菜單怎麼會這麼草率又沒細節？\n請加強員工訓練，\n請加強員工訓練，\n請加強員工訓練\n貴店是不是讓工讀生沒有做好訓練就讓他上工啊？\n連可頌都變難吃了，跟一年前第一次來吃時真的差好多，難道是有改配方嗎？重點是還是同樣價錢一樣貴，真的感覺很不好...', 'time': 1605403735}]",35266766
8,Bar Approx. 將進酒,4.5,新竹市東區金山街19號2樓,500,https://ifoodie.tw/restaurant/5c1c522223679c113a920419-Bar-Approx.-%E5%B0%87%E9%80%B2%E9%85%92,ChIJtblZbSQ3aDQRuD4Tegc5i6g,"{'lat': 24.7783818, 'lng': 121.0200741}",24.7783818,121.0200741,"[{'author_name': '孤獨的美食達人', 'author_url': 'https://www.google.com/maps/contrib/101009615817064522342/reviews', 'language': 'zh-Hant', 'profile_photo_url': 'https://lh3.googleusercontent.com/a-/AOh14Ghg21KfMAC_boay_2IwTgvUbf-Ig-b2T4de1U_J0jw=s128-c0x00000000-cc-rp-mo-ba3', 'rating': 1, 'relative_time_description': '本週', 'text': '一顆星不都想給\n近來通知要帶口罩 因為政府規定（裡面客人都沒帶口罩，正常喝酒誰會戴口罩放）\n後來自己朋友來不用帶口罩卻可以\n雙重標準 卻說會提供口罩給朋友\n瞎爆了.....\n調酒普通 確實個高價格\n可能當附近住的工程師盤子\n調的再好喝 態度零分 喝起來都不滿意\n\nBartender看到評論還叫朋友刷評論？做賊心虛？\n摸著自己良心吧', 'time': 1607798761}, {'author_name': 'Tuna Beauty', 'author_url': 'https://www.google.com/maps/contrib/118097983871753706099/reviews', 'language': 'zh-Hant', 'profile_photo_url': 'https://lh3.googleusercontent.com/a-/AOh14Gi_bg3PejpqunJ_GWNMsACvH483o1VWK6acWM7N8P0=s128-c0x00000000-cc-rp-mo-ba4', 'rating': 4, 'relative_time_description': '1 週前', 'text': '裝潢有情調有氣氛，服務態度很良好，這次點了三杯調酒一杯啤酒，體驗都很棒，會再造訪，下次會吃吃看餐點，最喜歡鳳梨調酒，味道特別，野格也調得很好。', 'time': 1607704062}, {'author_name': 'Gloria Lai', 'author_url': 'https://www.google.com/maps/contrib/104430958547871046264/reviews', 'language': 'zh-Hant', 'profile_photo_url': 'https://lh6.googleusercontent.com/-Ing_bZ3WilM/AAAAAAAAAAI/AAAAAAAAAAA/AMZuuclX4RJ-lA0p2mXhRl_2MlKmPPElUw/s128-c0x00000000-cc-rp-mo/photo.jpg', 'rating': 5, 'relative_time_description': '本週', 'text': '每一杯酒都很有巧思，bartender很專業，無論想喝什麼樣風味的酒都有，看到很多評論說男bartender態度差，我自己跟朋友去是都沒遇過這個狀況啦，感覺裡面男女bartender都滿好聊的，服務態度滿好的啊，是個值得一來的地方', 'time': 1607857580}, {'author_name': '劉姿妤', 'author_url': 'https://www.google.com/maps/contrib/104595317701227902892/reviews', 'language': 'zh-Hant', 'profile_photo_url': 'https://lh3.googleusercontent.com/-pUjjgEnlDs8/AAAAAAAAAAI/AAAAAAAAAAA/AMZuucmnHenytmCGywhrfawiPq8CCG2w-A/s128-c0x00000000-cc-rp-mo/photo.jpg', 'rating': 5, 'relative_time_description': '1 週前', 'text': '酒感重，Cp值很高，適合有在喝酒懂酒的人，喜歡喝甜妹酒的不建議來亂唷！很有質感的店，會再光顧！', 'time': 1607437385}, {'author_name': '積藏樂樂', 'author_url': 'https://www.google.com/maps/contrib/115043313368278085904/reviews', 'language': 'zh-Hant', 'profile_photo_url': 'https://lh3.googleusercontent.com/-TFrKCLSQc-0/AAAAAAAAAAI/AAAAAAAAAAA/AMZuucmuFuRBhbZjr_lF42wittg4jnlykA/s128-c0x00000000-cc-rp-mo/photo.jpg', 'rating': 5, 'relative_time_description': '2 個月前', 'text': '服務人員推薦的第一杯調酒＂玉兔言柚＂酒精濃度較低，以琴酒為基底，聞得到柚子的香氣，搭配鹽口杯更帶出柚子酒的清甜，上層微微的發泡蛋白提升了口感，整體來說是一杯清爽的調酒，做為第一杯開胃酒，推推唷👍，第二杯＂將進酒＂充分展現店家濃濃的中國風，入眼是東方神秘紫，入鼻是桂花清香，入喉是荔枝鮮甜但不膩口，很有層次的一杯酒，彷彿來趟穿越時空的古今之旅，這杯下肚後會有飄飄然的快感～不愧是招牌同名酒🤙，搭配現炸薯條就是波兒棒✌️！店內服務人員態度都很nice，每杯調酒份量也很夠！Cp值超高🤘～最近店家剛好推出2週年活動，新鮮的生蠔搭配調酒或啤酒～超享受👏\n會再造訪的店🍸🍹🍺🥂🥃🍻🍷', 'time': 1600680642}]",36686335
9,La Dolce Vita樂多趣義大利餐廳,4.5,新竹市東區學府路61巷5之2號,700,https://ifoodie.tw/restaurant/58c047b82756dd732689b5ba-La-Dolce-Vita%E6%A8%82%E5%A4%9A%E8%B6%A3%E7%BE%A9%E5%A4%A7%E5%88%A9%E9%A4%90,ChIJISOj3OU1aDQRcczo3dgWlOY,"{'lat': 24.7949417, 'lng': 120.9779278}",24.7949417,120.9779278,"[{'author_name': '盧冠宇', 'author_url': 'https://www.google.com/maps/contrib/105525055374689869251/reviews', 'language': 'zh-Hant', 'profile_photo_url': 'https://lh3.googleusercontent.com/-CX8Hv9xyK7o/AAAAAAAAAAI/AAAAAAAAAAA/AMZuucmFegkjHtVhx82HDceiT26DG_g4yQ/s128-c0x00000000-cc-rp-mo/photo.jpg', 'rating': 5, 'relative_time_description': '3 個月前', 'text': '東西好吃，環境不錯，人員服務也好', 'time': 1600091698}, {'author_name': 'Cyril Tang', 'author_url': 'https://www.google.com/maps/contrib/104643509222828072140/reviews', 'language': 'zh-Hant', 'profile_photo_url': 'https://lh3.googleusercontent.com/a-/AOh14GiK-hQvb0geCaOJG_faL-0PsaPNTuEMfWeyUAx9ZTY=s128-c0x00000000-cc-rp-mo-ba3', 'rating': 5, 'relative_time_description': '3 個月前', 'text': '招待人員解說很到位，好吃', 'time': 1599301010}, {'author_name': '羅中佑', 'author_url': 'https://www.google.com/maps/contrib/105787144723917636139/reviews', 'language': 'zh-Hant', 'profile_photo_url': 'https://lh4.googleusercontent.com/-28fBPT6lnMY/AAAAAAAAAAI/AAAAAAAAAAA/AMZuuckXfAL8z0okuijbfHPC5dM-77rjfQ/s128-c0x00000000-cc-rp-mo-ba3/photo.jpg', 'rating': 5, 'relative_time_description': '2 週前', 'text': '🇫🇷Ciao a tutti,benvenuti\n忠實呈現食物本身的味道是義大利料理的靈魂\n每一道菜吃進嘴裡，您能感受老闆對食物的用心\n慢工出細活是此刻最佳寫照！\n首先上菜的是蚵仔海鮮蛋煎，吃進去的每一口，都是海鮮的味道！\n第二道是披薩，咬勁，厚薄皆恰到好處！\n第三道是鮮蝦起司麵疙瘩，老闆說醬汁是用蝦頭慢熬出來的！\n最後是義大利經典甜點tiramisù ～buonissimo!\nBuon appetito.\n\nCi vediamo alla prossima.', 'time': 1607000912}, {'author_name': '戴郁樺', 'author_url': 'https://www.google.com/maps/contrib/103365351083668135955/reviews', 'language': 'zh-Hant', 'profile_photo_url': 'https://lh3.googleusercontent.com/--Xw6DBQ_f5g/AAAAAAAAAAI/AAAAAAAAAAA/AMZuuckJtRC164Sri64mEwMXXpVKyIL1Ow/s128-c0x00000000-cc-rp-mo/photo.jpg', 'rating': 5, 'relative_time_description': '1 個月前', 'text': '義大利麵非常好吃 而且其他的配餐也相當有水準 價格合理 需要打電話問是否有位子 很容易在吃飯時間都客滿 滿推薦的一家義大利麵餐廳.', 'time': 1605516139}, {'author_name': '楊引弘', 'author_url': 'https://www.google.com/maps/contrib/105249638725778442499/reviews', 'language': 'zh-Hant', 'profile_photo_url': 'https://lh5.googleusercontent.com/-ExjJAAxcfyA/AAAAAAAAAAI/AAAAAAAAAAA/AMZuuck9eQH5o1o_ENLhEjk9pPVBsZJ85w/s128-c0x00000000-cc-rp-mo/photo.jpg', 'rating': 5, 'relative_time_description': '1 個月前', 'text': '餐點好吃\n製作用心\n價格合理\n推薦義大利湯餃\n海鮮 Fritata\n帽子布丁\nPizaa有迷人的豹紋邊很到位😉', 'time': 1604846645}]",35735822
